text,id,lat,lon
airdriepaint airdriecanva oh uno boy think go friend wed tomorrow instead al fun,348631089964777474,51.26387594,-114.02873133
holi water sook ben poison,351820998770827264,51.03780923,-113.84235488
judibahl yes let go real world rule alli twitervers yeglif,350115840282206209,53.5153955,-113.28171138
awesom dinerwithjuli stranger offer one front line truck keep fade victim volant,349599442762088449,51.16759964,-114.09846475
cityofcalgari tenshi no water restriccion mean al run laundri pace,351143050115940355,51.07604287,-113.98826749
de monro get readi bed,351247724735242241,54.12713551,-115.78581899
omgfact al photocopi fault worldwid caus peopl sting martinahoiland,349574772994228225,53.53443267,-113.32365474
stevetvnew tune photo devin est sunset oregoncoast hip co use pateó nice pic,350872915685801984,50.9430535,-114.1285342
sun shine hot monton everyth done readi weekend hip co pnhfyskxik,350715996048343040,53.55955465,-113.44794377
mrliamwili got shit cut crop circl front lawn pic,350939292727640064,51.03556747,-114.074295
cloverdal resid say citi must prevent flow frustrant útil hip co xnlxaql,349885975377346561,53.53925427,-113.49975684
gestion movement within dozen be tra forev abeloth,350949869453721601,58.164,-113.309
kim kardashian could name babi south east right left útil got big bote no one wil forget asferday,348428138079985665,55.3036,-118.22836
watch al show network make hungri ate east dinersdriveinsand yum,349316025910706177,53.66709141,-113.61767693
ikepok ever play dur isildur live,349084176328310785,51.06130672,-113.94763955
lake louis start trip bang nation park hip co ab cj,351408255119003648,51.41676634,-116.21599674
amarkywel mis thank flower beauti,351473573027778560,51.0523545,-113.9824176
dude jrmcrank yep útil huge hole that oler hockey,351490956643667969,51.0153435,-112.922023
melisadasilva hay birthday buey haha shot later white girl wast hope god one hip co ntdjxdx rl,348789862939369474,53.47813244,-113.39305233
think safe asum oiler zona get everi one guy sudden play,351019057325150210,53.42549468,-113.89875021
even ese dri land calgari hip co txwvlwm,348131403269013504,51.05157748,-114.1211104
cabinet minist say no rodaj power plant demolición alberta cultur heather klimchuk said hip co het ds gym,350775828214333440,53.53925427,-113.49975684
god day leagu today,351551655512244226,53.6303211,-113.5066692
natasha ben drive hour tri get home no,348972930509717505,51.00146821,-114.05563263
stop smoke pleas tryingtoslep,350143229892632579,53.42896648,-113.43353845
meet deco man windshield repair hip co riwbcl ey,350312503013675008,50.998,-114.049
caught tv televis central great hr week recomendó wireless industri folk tech entusiasta nerd,350108649533870082,51.18114506,-114.14687486
helo summertim look forward judi long take lake heat hip co que,350234329210826752,53.52806225,-113.2806164
matbriton would oiler trade futur captain francois player way seguir rumor true,351034393453801473,53.25013206,-113.54467715
first pick no rainer es faster wtf think flame nhldraft tan,351449918642200577,50.92458213,-113.94745739
oh surpris induc pa mos,348627390316048384,53.6001699,-113.4652242
funesto moment pwawrestlingca far andi anderson write mat hold bal,348652482408374272,53.602359,-113.4584025
king south tip,351496329249308672,51.05912682,-113.97762278
wet ladi wana join sharpshoterai djlebstalion chestermer lake hip co pod oh ec,350750393644486657,51.0430108,-113.81677598
jackaltimelow posibl best pictur ever hip co c glabhyb,350860403925999616,53.01423121,-112.86873354
fun skate fot shitrolfesay,349365508379918336,53.45484496,-113.42314898
long war defend al equal irksom visitor anyon ga fix descripción th,350011857639186433,56.076,-112.254
hay canada day fellow canica,351728103128707074,49.91037437,-110.28903209
great photo calgarypolic keep safe ridley bike thank cds hip co uhm con,348456292731469824,51.03620476,-114.16029705
high river hit hard flow town one hardest comuniqu southern alberta hip co frilvb,348472523354165248,51.04839287,-114.05940132
right guy final work zona start son,351838823283560448,53.603152,-113.52072
ariesterm jengotclasna dedic make leo crazi,350100705832468481,56.67571686,-111.33985592
mc hockey actual real bad cuti thing al julian fault blackberri ils,350830812071079936,51.125631,-114.25216861
cylon yes absolut right,348588783521902592,50.9510887,-114.12934131
one devi said merc thumb toward street met groundcar,350653300091265024,53.26,-110.615
bridg nowher ycflod lindsay park hip co lo ogi nj,348227811292614656,51.03411995,-114.06605699
skagsjimi two area acr dado farm land,350083552555184131,51.77814993,-113.12301789
tiwatwet thank much mean lot us wil build beauti citi help ned ladi,348925147744448516,51.14765851,-114.17029473
maten could mirad thought deal would done laker tema,350324809630101506,53.5436962,-113.4856291
close report concern list request st se calgari hip co ex creat like servic,350756781816946689,51.01959147,-114.07388516
tim lok like fina cri,347922190915747840,53.61721585,-113.43776345
lol way school,349206598478073856,53.5897265,-113.41042463
anybodi know place repair iphon siren cheap,348263359650607104,53.51489293,-113.61210178
guy serious stop want justin go slut okay jelena perfect hay togeth damn drama,350666088247336961,51.06348619,-113.97879294
heart oler coaster mind knot kelsey talk crush weirdo poetico,349614674192498690,50.88166536,-114.0209786
erikabublez jtforbach breath enough death show,350469996771680259,51.06277989,-114.09259489
far east citi go past lakeview guy,349185410821419009,53.59798443,-113.38793855
michaelmuhney recent eastern canada take lok western calgari alberta suround area water,348302445455241216,50.97762262,-114.08512726
doth peopl ned learn figur prioriti subt,348312057017401348,53.53895929,-113.49732964
look god race weekend ned sunshin,350399234127835138,53.45702616,-113.90339151
peopl like cat atractivo,350428465696223232,55.1432691,-118.8326293
carmen smith gekalert los like found new bodi pilot,351785215569571842,51.0367195,-114.0413699
amandatoryfin rock rol bird peopl togeth crisi al local asshol strang tri make best,347970063204245504,51.04256565,-114.07486837
jager friend mine sen real complaint lack character mani player,348563810191306752,53.64767893,-113.62564818
world end calgari least geseapocalyps langevin bridg hip co uihusi,347902890398085121,51.04920126,-114.04834347
wow flor intent everyon evacuad,348141797601595393,51.13299988,-114.127225
sexyjbear fun ichiro felino el por babi mylovey sunday fama hip co us bruja,351512316900151297,53.61692555,-113.52592943
justin nowher close calgari experiencia riversid estructura home risk,348867064422858753,53.56362363,-113.48996274
hate pack tele wait minut eat uh no readi end stori,351141899450593281,53.01460305,-112.86904226
hard find girl high mainten man pais hand yeah right fed everi hour,351286535083139072,53.61348446,-113.53446865
blackberri ils alway wrong,348518985890922496,51.12575514,-114.2524951
lot stu hope mind right ned rest mani thing list must acomplish tomorrow,350897341861076993,50.9051239,-114.104152
coreydufti probabl put lot shit long extend period time,348520285034663936,53.55793046,-113.89332385
shout muscular cameo appear last night,350735474916212736,51.03757856,-113.29207845
max theactivestick thought refutar report cari contract like naboo could ben suspend,351808295805255680,53.5195361,-113.4569849
follow along home yes mosquito kinda lame,350383220258373632,51.1251665,-114.1846195
want know tran canada open canmoreflod,349306663376912384,51.00198718,-114.03982664
brenarlyc thank come calgari help flor,350042571621416960,51.06150764,-114.06063451
jeremyshan hear ya think,349650602252435456,53.50411185,-112.0589759
hand push weak spot cater bond held sab togeth,351197051268235264,52.052,-111.71
beauti one kind piec art squar fundrais silent austin tonight last hip co qwhqrbs,350420617943715841,55.17223585,-118.79203167
olymp plaza calgari ab other hip co oeakmgo,351800662520127488,51.04570031,-114.0593284
like nativ work today ask time half real nativeproblem hapyaboriginalday,348112407442366464,55.27703,-118.26795
arado thank al photo done great job,348316810422140929,51.05941401,-114.05193475
medicin hat public school dist cathol board joint statement censur hip co rd rflbwa mhflod sd ablo,348896875438546944,49.98041969,-110.72151657
neck whole back sore,349229570957910016,51.05929292,-114.01460392
keithjdhr mrskelyw haha debat terminología documento charter us style constitución,351221651691675648,53.54136379,-113.51550433
envió ex oler anyth,350613160652316676,53.6014664,-113.3783026
courtney wil check thank échele,350013537537638400,51.1251665,-114.1846195
tenshi inspir al calgarian one would never known state crisi el done thank,349446753654804480,51.03875308,-114.2161367
calgari zo remain close earli judi flow st georg island subsecuent clean hip co yoweri lem,348541728086716417,53.53925427,-113.49975684
hey come get cake sausag es fre stamper breakin anoth hour hip co hsvlekg,350252237383151617,51.02957952,-114.04972431
fun work sake devon alberta hip co dyfdrv va,349615950351433728,53.3601839,-113.72151876
maniowendi punta sa lake tomorrow morn eh sleep no night talk pag may time send mo shed skin,351222657175388161,53.45954629,-113.45384924
poutin rufian big cese poutineri hip co ljtflqi,351269363329933312,51.037924,-114.079079
tenshi knew real superman thank love help save day hip co en gas,350764633335951360,51.05251925,-114.14674955
wait se miguelunlimit sume rt,350041131876229121,50.93993,-114.07495
make heart fel someth,349193226676228097,53.55952393,-113.55832054
stay home peopl us work dont ned abe ranger louie los,348157474492256256,51.1831382,-114.50789364
jay win th row beauti wonder take make real god run wc spot interest,348915960654217216,53.42373126,-113.4602859
mani time flashlight ap save butreali,348690542315593728,50.93406953,-114.0540168
berthetank damn gue late say yes haha,349355435326836736,53.54407486,-113.52132868
danidontknowtec agred especi say true se news,349150129053372416,53.60212885,-113.02997134
calgari weather crazi bow river calgaryflod hip co tomi,348174223556112386,51.08734506,-114.0043808
two guy bosqu identica twin call ugli real talk self noth vicari,348746219570491392,53.388859,-114.225986
forgot someon bought pack stoke today útil ful lol wed yay,348660553004224512,53.62375879,-113.61334872
porschenoscent like day ycflod no longer even mention toronto star front page centreofunivers,349394105064894465,51.02689186,-114.11165577
rebelelondon follow back let one banki yes no,351640840239722497,51.05919919,-113.9776315
bankofmontr comerci stan basic talk custom,348639478795096064,51.1912669,-114.4803657
thatgirlaliyah someon gase tonight felino eh,349419869114085376,53.388859,-114.225986
two point spus come,347922043242676225,51.02929483,-113.99152519
bosnio ye son guna get lil fri weekend se,350336766089248768,51.25217391,-113.78905481
troy girar stupid teni gravitar back felino tema go interest danc clown show meow,350384495255486464,52.31924058,-113.81875475
goliat bo everyth nike sock,348539174867070978,53.44422702,-113.48350846
get readi im al cute know no,349006590042583042,53.00843415,-112.85241198
alberta food canadian help acto countri respondió masiva flow hip co awk,349284323955982337,53.53925427,-113.49975684
glad josiebajada birthday weekend get beber insuper dispersa,348961396534431744,50.89658735,-114.10594009
juancharqueno descripción make sound like satin random,349393680362258432,51.01616093,-114.21578888
mala along gana fuman realiz babi eat hay sunshin chang mean big time pregydiari fb,351743228027998208,53.49508069,-112.06190562
one ave bridg ycflod hip co du fr,348844684728221697,51.030333,-114.062964
god time west roto patio pic hip co dsrctxdm,351157833145929728,51.045891,-114.067395
alnewtpir pam brasyladi afternoon domin head max vet ok check wil talk bit luv guy xo,351078104397123584,52.97136115,-113.36583966
ils zona dump,349360720267313152,51.12569948,-114.25237793
wow th st bridg pack car al way ave se crazi ycflod,348109955980746754,51.1251665,-114.1846195
pick pace bagel manten heavi strike pound like drumbeat big help wound,349303922827071489,54.153,-114.103
want go beach lidi pol bring deadseri hungtiti partytilthesunsout,350699780818731008,53.01996347,-112.85285316
mathyoudicki yup want ditch band show watch instead,351406508594044930,53.69178117,-113.57013384
heartbreak flow calgari southern alberta,348187998363471872,51.06230955,-114.0048395
no one els make hay,348991977477517313,53.5782387,-113.55517404
market gasp god,348316986964594688,51.042921,-114.0827694
sparabtani maharani doesnt like puppi rude,348994069919313920,51.1593101,-113.9653599
morn chaparr vale river height poli slight larger golf cours home safe dri ycflod,348452271438323712,50.88596332,-114.0218655
monster drive tip flota lynn ridg golf hip co blin ow,349712319686782976,51.11520376,-114.25804998
head montana listen bretkisel startedwithasong new favourit song,350767960392073216,53.55597164,-113.24740377
beauti day hike brag countri sori útil close public ad tres ablo abrir,350993662412472323,51.06033702,-114.07719011
ofici monitoriza situat red der river útil rise citi keep close hip co el gszwd,348155887531220992,53.53925427,-113.49975684
fabiotag yup man ive never watch show chip hous month chang,350101479434104832,53.61560585,-113.46518982
god luck al angel pelona bringthegold texte,350458788458921984,50.9230294,-113.8684888
proud calgari peopl amaz testamento help,350044478175838209,52.3845365,-113.78056835
voyagevixen strang anyway cant get road want,350261058042208256,51.1251665,-114.1846195
think done chase hard watch someth work fal apart time let go,350883017956409344,55.15804886,-118.79188033
erikapoi readi obvious,350389625707180032,51.00044213,-114.07246915
lethtraf photo radar senil drive north past sugar bowl,349524042572759041,49.66821636,-112.79638025
erikwknudsen crazi cours definit enjoy act,348536908848177153,49.6755847,-112.8102777
newaveoil fort time also said cluterbuck oiler posibilitó,351382237352181760,53.6013925,-113.3783776
gorgeous man white shoe point gate make smile bring one plata sahib hip co ir dot,351770465527820289,51.03439198,-114.07170593
evacuast area tonito keep finger close river doesnt reach home,347938884748980225,51.08414032,-114.11429122
nice day hip co tojdouonr,351491572325568512,53.56646064,-113.54417186
fre mere cast one chain live way respecto enhanc freedom other nelson mandela,349871522405560323,53.50482388,-113.51343575
jordan wana say ur beauti insid forget hate pl give,349707910739275777,51.06339757,-113.97861355
shadiyasux lol alo us abajo got real late like wes ago,348266018273103873,53.388859,-114.225986
great stand alon hydrosec fix solut hex control hydrobloc hip co heh xd,351109047925239808,50.90373082,-113.98235625
lot though bit nose,348878771719385088,53.54662078,-113.51074202
jim cari handl gun violenc movi sport antigunact lok explos,349455970923069440,53.54235453,-113.58179644
guy tight rope grand canyon without barn bal crazi spywar,348985731127078912,50.888765,-114.0318606
stori tonight se calgari flodwat hip co uhnpku oin ycflod cbcnew,348275024387530752,51.05907023,-114.06767411
rt jeremyw premium time report near disast yesterday quiet basket case nigeria hip co sqidcjsfob,348361587876302849,56.76419934,-111.43197183
felino littl run past coupl day anyon look wil desk work sleep,349562841164038146,53.54049,-113.50463
mryankingsley eg,349391113242681345,50.00182282,-110.694712
rcp scene highway crash explos head hip co nic kya sc,349221919578529792,53.53925427,-113.49975684
karibear drianrok al front virgin lol,348992068477132800,51.0362718,-113.9810564
project cao zone one game crazi enough work útil confus stori though paz,351114986644455424,53.5445932,-113.4892794
say life suck haha stu,349336796833914880,53.59926143,-113.37827534
interest discusion crucial import educ cola shift mamá water canada watersumit,350314686790643716,51.13085487,-114.00842633
tashrainbow someon els messag ask acepto repli count,349318814900559872,51.85324383,-113.13429345
host pick cbcradio favourit chuck ad canadian life checkupcbc canada day show,350349242264588289,51.03777684,-114.07934457
peac bridg flore curl club park lot cop car hip co cbfmoe ep,348059624399843329,50.9632223,-114.0629883
burkeboy nice swing watch nerd great super weather sit insid ihaveaproblem,350088360141922304,53.63294106,-113.42621377
earth pic beauti place live aryan,349621031075459074,51.1059823,-113.9585969
sarah lind urban pictionari made ordinari peopl sometim get mese definicion,349400914475487234,51.85312236,-113.13448476
wait someon come home like gras grow timeistandingstil mismo,349613753710546948,50.94666619,-114.11630652
made teribl mistak,351395212385460224,52.29824704,-113.83021495
iamthekm alway readi sing along,350834085708566530,51.01595078,-114.21517315
desert cuisinechateau vine dine costear du rayon hikeski delici great night al round hip co mojowjlz,350804675886465025,51.05370064,-114.08603936
flame adquier david jone brien vas alex tanguy marica calgari hiper veterano forward hip co lp wtf,350410920486379520,51.04839287,-114.05940132
apricotacr yes bout sit togeth no zona tel sting,349666179381604354,50.3437815,-113.7760716
monabrezi fel life threaten real grey area mani time pl claim self defens voten,350296510837166081,53.388859,-114.225986
niña útil young wana no kid,348269889129160704,53.388859,-114.225986
perhap dala replica begin se anoth way defeat head state fel de,351235791931977729,58.935,-110.311
mudan batman nal lok tv market reveng,350106109215907842,52.21385167,-113.81210833
ctvcalgari emerg quédat tenshi calgari ask volant get échele,349298520701927424,51.03339696,-114.07182556
blakeshelton ha let tri hi blake sheldon big fan believ talk,350259237663944704,53.80442065,-113.63079057
malum worst schedul ever news calgari basic shut,349032726474682368,53.41843365,-113.44690289
big clean wil start son hope get citi back ycflod,348639513775583232,51.1069669,-114.20678125
brain game day big player ned tonight end el,348431648863428608,55.344887,-111.027904
antib religiouscrit interest could pleas provid get evid cuenco use time,348838485970546688,52.238548,-113.767627
metalgirlbuscus think know hot take advantag,348996006622404608,51.85324495,-113.13436708
end time field hip co mljtwdb,350062397861543936,52.784763,-113.17104
serious tray take close hour make much fruit,348455411436892165,51.28484,-114.00478
amandabyn stupid,348322762269552640,51.08634038,-114.19668577
realmitchalen air man curent haha,349655401727406080,52.88711267,-118.06080987
irsped engin ching high ceil ahead two airsped land half dozen larg,349982100012810240,54.512,-113.983
caiga joshmcin make ladera probabl cal bullshit lol,350317699777314816,52.98851975,-112.90614063
iliketatsdaili punk rock chick hip co wolf woucthat nice,349350142995996674,55.19223657,-118.77444462
let burn ground sor brother greyham cesara seanryand,349314265024446465,53.51437253,-113.48060321
flor volant organ roseboro échele time help peopl find home pic hip co th,349885347192254465,51.00454432,-114.1167386
studio tour chat media centr hip co tfpqvk nt,348096710817488896,49.915229,-110.9531895
consid wish real nice thing,350841600139739137,51.28472,-114.00466
acord boychuk hit toe scot steven lindo red legal okay deliberant head hunt inmun star decid grape,348652918225899520,53.60518,-113.51864
mental gas envió wait racion,350614497934843905,53.6014139,-113.3782306
stu ab cant spare rt heathermla ben told evacuast big thank calgari polic unbeliev,347941804890537985,53.6022949,-113.0299717
anyon know god montag broker,351154221497843712,50.91570914,-114.10868051
cityofcalgari pleas stay home frida avoid downtown,347932261171224576,51.03906356,-114.07624549
fun productivo night swing bring nanimizu althebasarafel,350531441639170048,51.19071345,-114.49278939
tri best get edmontonoil draft pbartosak,351474729917485056,52.2754575,-113.82071646
wow por citi much handl,350254104238497792,51.05271751,-113.94575261
tal work like fag let go saturado sunday heh ben craig pancak,350013643015983104,51.132351,-114.0086441
danieleburg benrowley actual sting complet elvi script canto confirma glow presenc orc,349023780246523904,49.69275781,-112.83703736
el tok hour go th arc canada olymp park turn around came home,348113241626521600,51.02257528,-114.17261311
demon spider stomach swear,348950886367756288,53.59693704,-113.38715304
cdnpackerfan hahahahahahahaha thank friend aron hernández,348277509227425792,53.25802921,-110.02404263
car shope take life,349280547475955713,52.30370418,-113.81524147
clarkmacgolf yes posit tomorrow,348122914886918145,51.14651134,-114.08615165
alberta cat owner spotlight dramat flor photo hip co lj kit via ctvnew,348201690916331520,50.9078451,-114.0736859
togeth hip co ldrxbvzd photo photographi,351505382641905667,50.927316,-113.956568
jenielockwel julianankova misalysamelo god know work hip co vueamlt,349272492369649665,53.59600809,-113.38283434
citi flow communiti sport provenc countri el tough time,347991173106917376,52.27548455,-113.82071255
tote walk bathroom wit guy ping phone urin like dignast notgonali,349670348112932865,51.0856881,-113.9774032
let keep box clark hous hip co fansub,350996980387946499,51.13782637,-114.21771116
yasmin mil harem sed,348039517879545856,53.50190632,-113.61775832
calgari food delay conserv parti convent nation polici hip co wqrhvwg,348518529848459264,53.53925427,-113.49975684
nhldraft today one fab day hockey much like ryder nba draft oiler thick davewaknuk,351407015777677312,55.18940019,-118.77918018
mubasherlucman ned long march dharma cj corrupto judg pm time throw retir,350885357241380864,53.50180084,-113.61748691
bourbondan wana know sure come hold tight love wild thing thi name bourbon,349726080309006336,53.53447344,-113.56903842
tonight love golf itsbentolong kepitup,349752158251515904,50.88608354,-114.01724626
apoy stamper concern throw parti help neighbor,349963410391318528,52.2344266,-113.7859889
nhlflame flame acquir david jone shane brien vas detail hip co nulfilzgp lleven whoah,350380122462887936,53.52729312,-113.52169849
real tun lol con fui shadealveranga mi cura chicken proud,350042730098987011,51.08312724,-114.00285077
play countri jameson ave calgari helorhighwat stamper,350876521398935552,51.03798898,-114.09081264
today uxyeg season final event tomorrow kelli st north jasper ave hip co zsmpclutym,349530299358642176,53.45689991,-113.51094801
think nap order,350413547676770306,51.070446,-114.15713894
pu pork sandwich sangria stile cooki ice cream someon cal doctor blog sugar level us go mil,351552803988185088,53.4466894,-113.4858035
thatnikonguy oh come mani gue least give stop number would god hint,348353168431804416,53.388859,-114.225986
tate phat buck hip co oliwrpx ir,351791725745938433,53.44677458,-113.56675493
raptor wrong mind head destrozan old player,351758677679681536,53.25108791,-113.53041597
god day far hamdilah famili nt know wat without em,351802689195220992,53.51293,-113.55285
leon want knock guy last toth drop kick sino,350391889268187136,51.26179573,-113.79746468
youralberta pleas poner beber peopl ned fel suport spirit lift,351098480170762240,51.05633902,-114.08243677
el shit eh oh ya time,348073318622048257,49.35308206,-113.45975786
fli tomorrow chain se hope start work monda timhorton crosfing pray,350885784099885056,50.9052326,-114.1042253
came home safe dri hous block rage bow river montgomeri ycflod,348243238186016768,51.06889563,-114.15827307
flew motorhom ft front us,350306421537120256,53.18566851,-113.59844021
tenshi say calgarian want help flor situat best thing limit water use travel,348506302986715137,51.05438347,-114.05438291
lol liberan beat thou love african song pegarl,348676036369711104,51.11623307,-114.06602291
neil mccoy rate bever hilbili theme song guy awesom music countri hip co joshi ni,348682179271864320,55.10929801,-118.75248098
hay birthday angelmari know god one,350880031167365120,51.04647548,-113.82996222
planetleor ful car go dermot complex,349547519883223044,51.15278318,-114.09458172
bigbudycolin voten email,349243868333608960,51.0433089,-114.17502546
god start bal journey hip co xrdlhckb,350998108743811072,52.2999588,-114.0822344
tenshi thank al hard work comunicación best leader citi could ask,348326646123745281,51.0033702,-114.07443882
love victor varga wil alway older brother hip co igt ham,351543957106352128,53.60408028,-113.43533171
jonathanwili call invis would insult peopl everywher,350730407886585861,53.6013949,-113.378394
help want back,348505003956256768,52.751,-116.4
keep distanc lot peopl think beber go two diferent direct,349010378132439040,51.05920416,-113.97745293
mis much benjaminlasni love tagsforlik hip co igua doc,351408227394658304,53.55172114,-113.93896329
peopl favorit player chris poner even old,349373321168687105,51.12576042,-114.25232344
could wors hous air condicion mine youwouldntmindwouldyou,350808289589723136,53.33091618,-110.49381117
joey honest like instagram video shit,351252066326417408,51.07790486,-114.09083946
oh bus art thou second ago rival wil comfort carnag,350405000956088320,51.1251665,-114.1846195
cairobodi count no alien encumbr hous discuss,350838871279403009,53.50070148,-113.47840254
el us gota work hrs tomorrow voluntad shit promis misionpos fuck,350506002094886913,51.03550757,-114.07434443
fist al leader ceo best worst traia entrepreneur hip co gasp ete,348157799718608896,53.56858485,-113.48792781
harisonmoney al seriousn noth il even buy ber,351838512078794754,51.14888156,-114.21189161
bebert hey edielack swedish polic search cycl caer bike seat dizer hip co ropa hja lol,350469410693185536,53.4990256,-113.6357263
hufpostweird man meal month hip co jason los weird say least,350128486503030785,55.18939028,-118.77904874
